ID;WijkenEnGemeenten;BewoondeHuizen_1;OnbewoondeWoonhuizen_2;WoonhuizenInAanbouw_3;OverigeOnbewoondeGebouwen_4;PermanentAanwezig_5;TijdelijkAanwezig_6;PermanentAanwezig_7;TijdelijkAanwezig_8;Mannen_9;Vrouwen_10;TotaleBevolking_11;Mannen_12;Vrouwen_13;Pagina_14
0;Algemeen totaal;235;3;0;16;5;0;0;0;653;681;1334;13;13;GR004
1;B, Totaal;95;2;0;2;5;0;0;0;278;268;546;4;5;GR004
2;B, A, Dorp Adorp, Huizen;17;1;0;0;0;0;0;0;45;42;87;0;0;GR004
3;B, A, Buurtsch. Adorpermeeden, Huizen;10;0;0;0;0;0;0;0;25;28;53;0;0;GR004
4;B, H, Buurtsch. Harssens, Huizen;13;0;0;0;0;0;0;0;30;38;68;1;1;GR004
5;B, H, Geh. Hekkum, Huizen;6;0;0;0;0;0;0;0;21;21;42;0;0;GR004
6;B, S, Dorp Sauwerd, Huizen;9;0;0;1;0;0;0;0;27;24;51;0;2;GR004
7;B, S, Dorp Sauwerd, Schepen;0;0;0;0;5;0;0;0;13;11;24;0;0;GR004
8;B, S, Buurtsch. Sauwerdermeeden, Huizen;10;0;0;0;0;0;0;0;25;18;43;1;0;GR004
9;B, S, Geh. Arwerd, Huizen;6;0;0;1;0;0;0;0;17;13;30;1;0;GR004
10;B, W, Buurtsch. Dorkwerd, Huizen;1;0;0;0;0;0;0;0;4;4;8;0;0;GR004
11;B, W, Buurtsch. Paddepoel, Huizen;5;0;0;0;0;0;0;0;17;19;36;0;0;GR004
12;B, W, Buurtsch. Wetsingermeeden, Huizen;9;0;0;0;0;0;0;0;28;25;53;1;2;GR004
13;B, W, Dorp Wetsinge, Huizen;5;0;0;0;0;0;0;0;17;15;32;0;0;GR004
14;B, W, Geh. Wierum, Huizen;4;1;0;0;0;0;0;0;9;10;19;0;0;GR004
15;K, Totaal;140;1;0;14;0;0;0;0;375;413;788;9;8;GR004
16;K, A, Dorp Adorp, Huizen;43;0;0;5;0;0;0;0;121;127;248;3;1;GR004
17;K, S, Dorp Sauwerd, Huizen;70;0;0;5;0;0;0;0;182;207;389;6;4;GR004
18;K, W, Dorp Wetsinge, Huizen;27;1;0;4;0;0;0;0;72;79;151;0;3;GR004
19;Algemeen totaal;481;11;0;29;9;3;0;0;952;1002;1954;33;37;GR004
20;B, Totaal;182;6;0;12;9;3;0;0;463;472;935;16;15;GR004
21;B, A, Dorp Aduard, Huizen;7;0;0;0;0;0;0;0;15;11;26;0;1;GR004
22;B, A, Dorp Aduard, Schepen;0;0;0;0;8;0;0;0;15;16;31;0;0;GR004
23;B, A, Dorp Aduard, Tijd. aanw. schip;0;0;0;0;0;1;0;0;0;0;0;3;2;GR004
24;B, B, Geh. Fransum, Huizen;29;2;0;3;0;0;0;0;77;68;145;0;2;GR004
25;B, C, Dorp den Ham, Huizen;38;1;0;4;0;0;0;0;101;96;197;6;1;GR004
26;B, D, Buurtsch. Hoogemeeden, Huizen;39;1;0;4;0;0;0;0;87;111;198;0;0;GR004
27;B, E, Buurtsch. Lagemeeden, Huizen;35;0;0;1;0;0;0;0;70;76;146;0;3;GR004
28;B, E, Buurtsch. Lagemeeden, Schepen;0;0;0;0;1;0;0;0;1;1;2;0;0;GR004
29;B, E, Buurts. Lagemeeden, Td. aanw. sch.;0;0;0;0;0;1;0;0;0;0;0;2;4;GR004
30;B, F, Buurtsch. Wierum, Huizen;34;2;0;0;0;0;0;0;97;93;190;3;1;GR004
31;B, F, Buurts. Wierum, Tijd. aanw. sch.;0;0;0;0;0;1;0;0;0;0;0;2;1;GR004
32;K, Totaal;299;5;0;17;0;0;0;0;489;530;1019;17;22;GR004
33;K, A, Dorp Aduard, Huizen;203;2;0;11;0;0;0;0;337;357;694;12;18;GR004
34;K, C, Dorp den Ham, Huizen;47;3;0;2;0;0;0;0;75;81;156;3;0;GR004
35;K, D, Dorp den Horn, Huizen;49;0;0;4;0;0;0;0;77;92;169;2;4;GR004
36;Algemeen totaal;742;5;1;102;36;13;0;0;2100;2248;4348;95;90;GR005
37;B, Totaal;323;4;0;49;35;12;0;0;1014;985;1999;50;35;GR005
38;B, E, Dorp Opwierde, Huizen;92;0;0;13;0;0;0;0;223;241;464;8;4;GR005
39;B, F, Dorp Solwerd, Kazerne Kon. Mar.;1;0;0;0;0;0;0;0;8;10;18;0;0;GR005
40;B, F, Dorp Solwerd, Overige huizen;48;1;0;11;0;0;0;0;118;121;239;5;4;GR005
41;B, F, Dorp Solwerd, Schepen;0;0;0;0;3;0;0;0;10;7;17;0;0;GR005
42;B, F, Dorp Solwerd, Tijd. aanw. schepen;0;0;0;0;0;2;0;0;0;0;0;5;4;GR005
43;B, G, Dorp Marsum, Huizen;13;0;0;1;0;0;0;0;40;45;85;1;1;GR005
44;B, H, Dorp Jukwerd, Huizen;18;1;0;1;0;0;0;0;53;38;91;1;2;GR005
45;B, I, Dorp Tjamsweer, Huizen;106;2;0;13;0;0;0;0;322;289;611;7;4;GR005
46;B, I, Dorp Tjamsweer, Schepen;0;0;0;0;23;0;0;0;61;60;121;0;0;GR005
47;B, I, Dorp Tjamsweer, Tijd. aanw. sch.;0;0;0;0;0;3;0;0;0;0;0;8;9;GR005
48;B, K, Buurts. Bolwerk, en Wierde, Huizen;45;0;0;10;0;0;0;0;152;154;306;6;4;GR005
49;B, K, Buurts. Bolwerk, en Wierde, Sch.;0;0;0;0;9;0;0;0;27;20;47;0;0;GR005
50;B, K, Buurts. Bolwerk, en Wierde, Td....;0;0;0;0;0;7;0;0;0;0;0;9;3;GR005
51;K, Totaal;419;1;1;53;1;1;0;0;1086;1262;2348;45;55;GR005
52;K, A, Appingedam, Rijks Strafgevangenis;1;0;0;0;0;0;0;0;0;3;3;0;10;GR005
53;K, A, Appingedam, Weesh. der N. H. Gem.;1;0;0;0;0;0;0;0;2;3;5;0;0;GR005
54;K, A, Appingedam, Overige huizen;62;0;0;10;0;0;0;0;172;192;364;8;6;GR005
55;K, B, Appingedam, Huizen;123;1;0;7;0;0;0;0;265;343;608;15;8;GR005
56;K, C, Appingedam, Huizen;142;0;1;17;0;0;0;0;428;455;883;9;15;GR005
57;K, C, Appingedam, Schepen;0;0;0;0;1;0;0;0;0;1;1;0;0;GR005
58;K, C, Appingedam, Tijd. aanw. schip;0;0;0;0;0;1;0;0;0;0;0;3;4;GR005
59;K, D, Appingedam, Huizen;80;0;0;19;0;0;0;0;204;241;445;8;10;GR005
60;K, K, Buurtsch. Bolwerk, Huizen;10;0;0;0;0;0;0;0;15;24;39;2;2;GR005
61;Onbekend;0;0;0;0;0;0;0;0;0;1;1;0;0;GR005
62;Algemeen totaal;449;4;0;17;8;5;1;0;1300;1267;2567;54;36;GR006
63;B, Totaal;86;2;0;2;1;3;0;0;323;282;605;16;12;GR006
64;B, A, Dorp Andel, Huizen;28;1;0;0;0;0;0;0;95;86;181;2;0;GR006
65;B, A, Dorp Andel, Schepen;0;0;0;0;1;0;0;0;1;1;2;0;0;GR006
66;B, B, Dorp Baflo, Huizen;13;0;0;2;0;0;0;0;50;41;91;2;0;GR006
67;B, R, Dorp Rasquert, Huizen;16;0;0;0;0;0;0;0;56;52;108;3;2;GR006
68;B, R, Dorp Rasquert, Tijd. aanw. schepen;0;0;0;0;0;2;0;0;0;0;0;4;2;GR006
69;B, S, Dorp Saaxumhuizen, Huizen;15;0;0;0;0;0;0;0;61;58;119;2;1;GR006
70;B, S, Dorp Saaxumhuizen, Td. aanw. sch.;0;0;0;0;0;1;0;0;0;0;0;3;5;GR006
71;B, T, Dorp Tinallinge, Huizen;14;1;0;0;0;0;0;0;60;44;104;0;2;GR006
72;K, Totaal;363;2;0;15;7;2;1;0;977;985;1962;38;24;GR006
73;K, A, Dorp Andel, Huizen;114;0;0;4;0;0;0;0;363;355;718;11;6;GR005
74;K, B, Dorp Baflo, Huizen;151;2;0;6;0;0;0;0;352;374;726;12;13;GR005
75;K, B, Dorp Baflo, Schepen;0;0;0;0;7;0;0;0;15;16;31;0;0;GR005
76;K, B, Dorp Baflo, Tijd. aanw. schip;0;0;0;0;0;1;0;0;0;0;0;2;1;GR005
77;K, R, Geh. Rasquert, Huizen;52;0;0;0;0;0;0;0;153;132;285;4;2;GR005
78;K, R, Geh. Rasquert, Tijd. aanw. schip;0;0;0;0;0;1;0;0;0;0;0;1;0;GR005
79;K, R, Geh. Rasquert, Woonwagen;0;0;0;0;0;0;1;0;1;3;4;0;0;GR005
80;K, S, Dorp Saaxumhuizen, Huizen;16;0;0;3;0;0;0;0;35;43;78;2;0;GR006
81;K, F, Dorp Tinnallinge, Huizen;30;0;0;2;0;0;0;0;58;62;120;6;2;GR006
82;Algemeen totaal;802;9;0;72;23;10;0;0;2415;2479;4894;93;64;GR007
83;B, Totaal;323;3;0;22;0;0;0;0;951;937;1888;15;12;GR007
84;B, Dorp Bedum, Huizen;79;0;0;10;0;0;0;0;196;191;387;5;2;GR006
85;B, Buurtsch. den Haver, Huizen;2;0;0;0;0;0;0;0;6;7;13;0;0;GR006
86;B, Buurtsch. ter Laan, Huizen;20;1;0;0;0;0;0;0;54;52;106;0;2;GR006
87;B, Buurtsch. Waterleuzen, Huizen;3;0;0;0;0;0;0;0;13;9;22;0;0;GR006
88;B, Buurtsch. Lutjewolde, Huizen;1;0;0;0;0;0;0;0;2;3;5;0;0;GR006
89;B, Buurtsch. Schultinga, Huizen;2;0;0;0;0;0;0;0;9;7;16;0;0;GR006
90;B, Buurtsch. Reidland, Huizen;9;0;0;2;0;0;0;0;34;34;68;0;0;GR006
91;B, Buurtsch. Ellerhuizen, Huizen;24;0;0;0;0;0;0;0;81;75;156;1;1;GR006
92;B, Buurtsch. Westerdijkshorn, Huizen;20;0;0;2;0;0;0;0;63;61;124;1;0;GR006
93;B, Dorp Onderdendam, Huizen;9;0;0;0;0;0;0;0;13;12;25;0;0;GR006
94;B, Buurtsch. Roodewolt, Huizen;8;2;0;1;0;0;0;0;23;22;45;0;0;GR006
95;B, Buurtsch. Menkeweer, Huizen;2;0;0;0;0;0;0;0;6;8;14;0;0;GR006
96;B, Buurtsch. Onderwierum, Huizen;20;0;0;1;0;0;0;0;54;62;116;1;0;GR006
97;B, Dorp Zuidwolde, Huizen;31;0;0;4;0;0;0;0;95;98;193;4;4;GR007
98;B, Buurtsch. Beijnum, Huizen;8;0;0;0;0;0;0;0;27;24;51;1;2;GR007
99;B, Buurtsch. Zuidwending, Huizen;1;0;0;0;0;0;0;0;1;4;5;0;0;GR007
100;B, Buurtsch. Oost van Zuidwolde, Huizen;18;0;0;0;0;0;0;0;58;59;117;0;0;GR007
101;B, Buurtsch. Nienhuizen, Huizen;2;0;0;0;0;0;0;0;11;5;16;0;0;GR007
102;B, Buurtsch. Noorder Hoogebrug, Huizen;17;0;0;0;0;0;0;0;56;46;102;0;0;GR007
103;B, Dorp Noordwolde, Huizen;42;0;0;2;0;0;0;0;135;148;283;1;1;GR007
104;B, Buurtsch. Plattenburg, Huizen;5;0;0;0;0;0;0;0;14;10;24;1;0;GR007
105;K, Totaal;479;6;0;50;23;10;0;0;1463;1542;3005;78;52;GR006
106;K, Dorp Bedum, Huizen;277;4;0;27;0;0;0;0;846;885;1731;25;23;GR006
107;K, Dorp Bedum, Schepen;0;0;0;0;8;0;0;0;19;15;34;0;0;GR006
108;K, Dorp Bedum, Tijd. aanw. schepen;0;0;0;0;0;2;0;0;0;0;0;7;4;GR006
109;K, Dorp Onderdendam, Huizen;108;2;0;13;0;0;0;0;275;315;590;9;8;GR006
110;K, Dorp Onderdendam, Schepen;0;0;0;0;13;0;0;0;33;29;62;0;0;GR006
111;K, Dorp Onderdendam, Tijd. aanw. schepen;0;0;0;0;0;6;0;0;0;0;0;19;9;GR006
112;K, Dorp Zuidwolde, Huizen;67;0;0;9;0;0;0;0;215;215;430;5;1;GR006
113;K, Dorp Zuidwolde, Schepen;0;0;0;0;2;0;0;0;4;8;12;0;0;GR006
114;K, Dorp Zuidwolde, Tijd. aanw. schepen;0;0;0;0;0;2;0;0;0;0;0;9;3;GR006
115;K, Dorp Noordwolde, Huizen;27;0;0;1;0;0;0;0;71;75;146;4;4;GR006
116;Onbekend;0;0;0;0;0;0;0;0;1;0;1;0;0;GR007
117;Algemeen totaal;949;20;1;7;11;4;0;0;2089;2034;4123;78;56;GR008
118;B, Totaal;511;13;0;4;11;4;0;0;1195;1134;2329;46;30;GR008
119;B, A, Dorp Nieuw-Beerta, Huizen;94;4;0;2;0;0;0;0;226;244;470;14;5;GR007
120;B, A, Geh. Oudedijk, Huizen;118;6;0;1;0;0;0;0;245;215;460;2;1;GR007
121;B, A, Geh. Schanskerdijk, Huizen;5;0;0;0;0;0;0;0;15;8;23;0;0;GR007
122;B, A, Geh. Oudezijl, Huizen;52;0;0;0;0;0;0;0;104;105;209;1;0;GR007
123;B, A, Geh. Oudezijl, Schepen;0;0;0;0;5;0;0;0;8;9;17;0;0;GR007
124;B, A, Geh. Oudezijl, Tijd. aanw. schepen;0;0;0;0;0;3;0;0;0;0;0;13;9;GR007
125;B, A, Geh. Kroonpolder, Huizen;9;0;0;0;0;0;0;0;34;28;62;0;2;GR007
126;B, A, Geh. Oude Statenzijl, Huizen;2;0;0;0;0;0;0;0;5;5;10;0;0;GR007
127;B, A, Geh. Nieuwe Statenzijl, Huizen;2;0;0;0;0;0;0;0;5;4;9;0;0;GR007
128;B, A, Geh. Stadspolder, Huizen;10;0;0;0;0;0;0;0;34;35;69;1;3;GR007
129;B, A, Geh. Reiderwolderpolder, Huizen;2;0;0;0;0;0;0;0;8;4;12;0;0;GR007
130;B, B, Dorp Beerta West, Huizen;182;3;0;1;0;0;0;0;400;360;760;9;3;GR007
131;B, B, Dorp Beerta Oost, Huizen;1;0;0;0;0;0;0;0;1;1;2;0;0;GR007
132;B, B, Geh. Beersterhoogen, Huizen;18;0;0;0;0;0;0;0;52;52;104;4;1;GR007
133;B, B, Geh. Zandhoogte, Huizen;1;0;0;0;0;0;0;0;2;4;6;0;1;GR007
134;B, B, Geh. Kloostergare, Huizen;1;0;0;0;0;0;0;0;5;4;9;0;0;GR007
135;B, B, Geh. Winschoterzijl, Huizen;4;0;0;0;0;0;0;0;6;11;17;0;0;GR008
136;B, B, Geh. Winschoterzijl, Schepen;0;0;0;0;6;0;0;0;17;17;34;0;0;GR008
137;B, B, Geh. Winschoterzijl, Td. aw. sch.;0;0;0;0;0;1;0;0;0;0;0;1;5;GR008
138;B, B, Geh. Ulsda, Huizen;10;0;0;0;0;0;0;0;28;28;56;1;0;GR008
139;K, Totaal;438;7;1;3;0;0;0;0;894;900;1794;32;26;GR007
140;K, A, Dorp Nieuw-Beerta, Huizen;74;0;0;0;0;0;0;0;149;133;282;7;1;GR007
141;K, A, Geh. Drieborg, Huizen;38;2;0;0;0;0;0;0;81;95;176;5;2;GR007
142;K, A, Geh. Oudedijk, Huizen;1;0;0;0;0;0;0;0;3;3;6;0;0;GR007
143;K, B, Dorp Beerta Oost, Burg. Armenh.;1;0;0;0;0;0;0;0;15;5;20;0;0;GR007
144;K, B, Dorp Beerta Oost, Overige huizen;324;5;1;3;0;0;0;0;646;664;1310;20;23;GR007
145;Algemeen totaal;792;38;0;27;14;2;0;0;1823;1862;3685;49;27;GR009
146;B, Totaal;237;10;0;2;0;0;0;0;659;649;1308;18;6;GR009
147;B, A, Dorp Bierum, Huizen;14;1;0;0;0;0;0;0;48;48;96;1;0;GR009
148;B, A, Gehucht Nieuwstad, Huizen;11;0;0;0;0;0;0;0;25;30;55;0;0;GR009
149;B, A, Gehucht Oude Dijk, Huizen;6;1;0;0;0;0;0;0;15;13;28;0;0;GR009
150;B, A, Gehucht Hoog Watum, Huizen;2;0;0;0;0;0;0;0;9;5;14;3;1;GR009
151;B, B, Dorp Godlinze, Huizen;28;1;0;0;0;0;0;0;72;69;141;2;1;GR009
152;B, C, Dorp Holwierde, Huizen;5;0;0;0;0;0;0;0;18;20;38;0;0;GR009
153;B, C, Gehucht Katmis, Huizen;20;2;0;0;0;0;0;0;36;47;83;0;1;GR009
154;B, C, Gehucht Uitende, Huizen;15;0;0;0;0;0;0;0;48;41;89;2;0;GR009
155;B, C, Gehucht Nansum, Huizen;20;1;0;0;0;0;0;0;38;41;79;0;0;GR009
156;B, C, Gehucht Bansum, Huizen;13;2;0;0;0;0;0;0;26;35;61;2;2;GR009
157;B, C, Gehucht Kleinwierum, Huizen;3;0;0;0;0;0;0;0;6;8;14;1;0;GR009
158;B, C, Gehucht Lutjeburen, Huizen;2;1;0;0;0;0;0;0;9;7;16;0;0;GR009
159;B, C, Gehucht Oldenklooster, Huizen;3;0;0;0;0;0;0;0;10;9;19;0;0;GR009
160;B, D, Dorp Krewerd, Huizen;9;0;0;0;0;0;0;0;18;14;32;0;0;GR009
161;B, D, Gehucht de Klip, Huizen;2;0;0;0;0;0;0;0;3;5;8;0;0;GR009
162;B, D, Gehucht Arwerd, Huizen;7;0;0;2;0;0;0;0;24;25;49;0;0;GR009
163;B, D, Gehucht Nieuwenklooster, Huizen;3;0;0;0;0;0;0;0;12;8;20;0;0;GR009
164;B, E, Dorp Losdorp, Huizen;6;0;0;0;0;0;0;0;20;16;36;0;0;GR009
165;B, F, Dorp Spijk, Huizen;53;1;0;0;0;0;0;0;167;160;327;5;1;GR009
166;B, F, Gehucht Tweehuizen, Huizen;3;0;0;0;0;0;0;0;15;10;25;1;0;GR009
167;B, F, Gehucht Dekkershuizen, Huizen;3;0;0;0;0;0;0;0;10;8;18;0;0;GR009
168;B, F, Gehucht Vierhuizen, Huizen;4;0;0;0;0;0;0;0;15;16;31;0;0;GR009
169;B, F, Buurtsch. Oostpolder, Huizen;5;0;0;0;0;0;0;0;15;14;29;1;0;GR009
170;K, Totaal;555;28;0;25;14;2;0;0;1164;1213;2377;31;21;GR009
171;K, A, dorp Bierum, Huizen;103;12;0;5;0;0;0;0;202;244;446;10;3;GR008
172;K, A, dorp Bierum, Schepen;0;0;0;0;3;0;0;0;8;5;13;0;0;GR008
173;K, B, dorp Godlinze, Huizen;100;6;0;3;0;0;0;0;199;207;406;5;1;GR008
174;K, C, dorp Holwierde, Huizen;26;3;0;3;0;0;0;0;55;52;107;3;0;GR008
175;K, C, dorp Holwierde, Schepen;0;0;0;0;3;0;0;0;6;10;16;0;0;GR008
176;K, C, dorp Holwierde, Tijd. aanw. sch.;0;0;0;0;0;2;0;0;0;0;0;4;4;GR008
177;K, C, gehucht Katmis, Huizen;68;1;0;2;0;0;0;0;140;140;280;2;4;GR008
178;K, D, Krewerd, Huizen;36;1;0;2;0;0;0;0;64;64;128;1;4;GR008
179;K, D, Krewerd, Schepen;0;0;0;0;1;0;0;0;1;0;1;0;0;GR008
180;K, E, dorp, Losdorp, Huizen;34;1;0;2;0;0;0;0;69;74;143;1;2;GR008
181;K, E, dorp, Losdorp, Schepen;0;0;0;0;1;0;0;0;1;4;5;0;0;GR008
182;K, F, Dorp Spijk, Huizen;188;4;0;8;0;0;0;0;405;398;803;5;3;GR009
183;K, F, Dorp Spijk, Schepen;0;0;0;0;6;0;0;0;14;15;29;0;0;GR009
184;Algemeen totaal;1087;43;0;82;27;4;0;0;2454;2450;4904;56;30;GR035
185;B, Totaal;343;8;0;42;3;2;0;0;963;883;1846;17;15;GR035
186;B, A, Ten Boer, Huizen;28;2;0;3;0;0;0;0;79;73;152;1;0;GR034
187;B, A, Boltklapstreek, Huizen;14;1;0;2;0;0;0;0;37;29;66;1;0;GR034
188;B, A, Boltklapstreek, Tijd. aanw. schip;0;0;0;0;0;1;0;0;0;0;0;1;0;GR034
189;B, A, Bouwerschap, Huizen;6;0;0;0;0;0;0;0;17;19;36;1;0;GR034
190;B, A, Lutjewolde, Huizen;6;0;0;2;0;0;0;0;16;18;34;0;0;GR034
191;B, A, Sint Annen, Huizen;16;0;0;2;0;0;0;0;41;40;81;1;1;GR034
192;B, B, Heidenschap, Huizen;48;2;0;3;0;0;0;0;132;130;262;1;1;GR034
193;B, B, Heidenschap, Schepen;0;0;0;0;2;0;0;0;6;3;9;0;0;GR034
194;B, B, Heidenschap, Tijd. aanw. schip;0;0;0;0;0;1;0;0;0;0;0;1;2;GR034
195;B, B, Garmerwolde, Huizen;42;1;0;8;0;0;0;0;102;95;197;3;1;GR034
196;B, B, Garmerwolde, Schepen;0;0;0;0;1;0;0;0;1;1;2;0;0;GR034
197;B, B, Bovenrijge, Huizen;8;0;0;1;0;0;0;0;34;32;66;1;3;GR034
198;B, C, Thesinge, Huizen;29;0;0;4;0;0;0;0;93;86;179;0;2;GR034
199;B, D, Lellens, Huizen;10;0;0;1;0;0;0;0;27;22;49;0;0;GR034
200;B, D, Heemert, Huizen;6;1;0;0;0;0;0;0;23;18;41;0;1;GR034
201;B, E, Kroddeburen, Huizen;1;0;0;0;0;0;0;0;1;1;2;0;0;GR034
202;B, E, Ten Post, Huizen;20;0;0;8;0;0;0;0;55;43;98;0;0;GR034
203;B, E, Winneweer, Huizen;19;0;0;0;0;0;0;0;42;47;89;2;0;GR034
204;B, E, Wittewierum, Huizen;25;1;0;0;0;0;0;0;83;70;153;1;1;GR034
205;B, E, Over 't Schild, Huizen;21;0;0;1;0;0;0;0;48;43;91;1;1;GR034
206;B, F, Woltersum, Huizen;29;0;0;6;0;0;0;0;83;68;151;1;2;GR034
207;B, F, Luddeweer, Huizen;6;0;0;1;0;0;0;0;21;20;41;0;0;GR035
208;B, F, Blokum, Huizen;9;0;0;0;0;0;0;0;22;25;47;1;0;GR035
209;K, Totaal;744;35;0;40;24;2;0;0;1489;1567;3056;39;15;GR034
210;K, A, Ten Boer, Huizen;98;3;0;5;0;0;0;0;205;187;392;2;2;GR034
211;K, A, Boltklapstreek, Huizen;69;0;0;9;0;0;0;0;140;159;299;1;1;GR034
212;K, A, Boltklapstreek, Schepen;0;0;0;0;4;0;0;0;9;7;16;0;0;GR034
213;K, A, Boltklapstreek. Tijd. aanw. schip;0;0;0;0;0;1;0;0;0;0;0;2;2;GR034
214;K, A, Sint Annen, Huizen;75;3;0;2;0;0;0;0;137;138;275;3;2;GR034
215;K, B, Garmerwolde, Huizen;60;6;0;5;0;0;0;0;134;136;270;14;0;GR034
216;K, C, Thesinge, Huizen;110;5;0;5;0;0;0;0;220;244;464;5;0;GR034
217;K, C, Thesinge, Schepen;0;0;0;0;1;0;0;0;3;2;5;0;0;GR034
218;K, D, Lellens, Huizen;26;4;0;2;0;0;0;0;56;48;104;1;2;GR034
219;K, E, Kroddeburen, Huizen;39;4;0;1;0;0;0;0;67;78;145;1;0;GR034
220;K, E, Kroddeburen, Schepen;0;0;0;0;1;0;0;0;2;4;6;0;0;GR034
221;K, E, Wittewierum, Huizen;19;0;0;1;0;0;0;0;45;46;91;0;1;GR034
222;K, E, Ten Post, Huizen;104;2;0;5;0;0;0;0;177;187;364;2;2;GR034
223;K, E, Ten Post, Schepen;0;0;0;0;9;0;0;0;18;19;37;0;0;GR034
224;K, F, Woltersum, Huizen;144;8;0;5;0;0;0;0;254;289;543;7;2;GR034
225;K, F, Woltersum, Schepen;0;0;0;0;9;0;0;0;22;23;45;0;0;GR034
226;K, F, Woltersum, Tijd. aanw. schip;0;0;0;0;0;1;0;0;0;0;0;1;1;GR034
227;Onbekend;0;0;0;0;0;0;0;0;2;0;2;0;0;GR035
228;Algemeen totaal;1537;35;2;161;60;49;0;0;3706;3689;7395;159;148;GR010
229;B, Totaal;310;12;0;0;31;49;0;0;850;821;1671;114;101;GR010
230;B, A, Delfzijl, Schepen;0;0;0;0;20;0;0;0;41;33;74;0;0;GR010
231;B, A, Delfzijl, Tijd. aanw. schepen;0;0;0;0;0;47;0;0;0;0;0;96;83;GR010
232;B, B, Dorp Farmsum, Huizen;103;9;0;0;0;0;0;0;273;259;532;4;8;GR010
233;B, B, Dorp Farmsum, Schepen;0;0;0;0;11;0;0;0;23;18;41;0;0;GR010
234;B, C, Dorp Weiwerd, Huizen;36;0;0;0;0;0;0;0;83;91;174;0;0;GR010
235;B, C, Dorp Weiwerd, Tijd. aanw. schip;0;0;0;0;0;1;0;0;0;0;0;3;1;GR010
236;B, D, Dorp Heveskes, Huizen;40;1;0;0;0;0;0;0;97;91;188;3;0;GR010
237;B, E, Dorp Oterdum, Huizen;34;0;0;0;0;0;0;0;88;91;179;1;1;GR010
238;B, F, Dorp Meedhuizen, Huizen;32;1;0;0;0;0;0;0;88;82;170;0;0;GR010
239;B, F, Dorp Meedhuizen, Tijd. aanw. schip;0;0;0;0;0;1;0;0;0;0;0;3;3;GR010
240;B, G, Dorp Uitwierda, Huizen;65;1;0;0;0;0;0;0;157;156;313;4;5;GR010
241;K, Totaal;1227;23;2;161;29;0;0;0;2856;2868;5724;45;47;GR009
242;K, A, Delfzijl, Huizen;561;13;2;49;0;0;0;0;1243;1286;2529;28;29;GR009
243;K, A, Delfzijl, Schepen;0;0;0;0;26;0;0;0;83;61;144;0;0;GR009
244;K, B, Dorp Farmsum, Huizen;401;6;0;67;0;0;0;0;936;935;1871;9;7;GR009
245;K, B, Dorp Farmsum, Schepen;0;0;0;0;3;0;0;0;6;5;11;0;0;GR009
246;K, C, Dorp Weiwerd, Huizen;88;1;0;5;0;0;0;0;175;189;364;2;7;GR009
247;K, D, Dorp Heveskes, Huizen;53;1;0;3;0;0;0;0;127;106;233;3;1;GR009
248;K, E, Dorp Oterdum, Huizen;40;1;0;4;0;0;0;0;104;107;211;2;0;GR009
249;K, F, Dorp Meedhuizen, Huizen;52;1;0;11;0;0;0;0;114;119;233;1;2;GR009
250;K, G, Dorp Uitwierda, Huizen;32;0;0;22;0;0;0;0;68;60;128;0;1;GR009
251;Algemeen totaal;615;24;0;35;7;1;0;0;1312;1413;2725;44;22;GR010
252;B, Totaal;199;14;0;7;7;1;0;0;541;529;1070;11;8;GR010
253;B, A, Dorp Eenrum, Huizen;56;5;0;1;0;0;0;0;173;159;332;3;5;GR010
254;B, B, Dorp Pieterburen, Huizen;48;2;0;2;0;0;0;0;145;125;270;5;1;GR010
255;B, B, Dorp Pieterburen, Schepen;0;0;0;0;5;0;0;0;9;5;14;0;0;GR010
256;B, C, Dorp Westernieland, Huizen;79;6;0;3;0;0;0;0;168;191;359;1;0;GR010
257;B, C, Dorp Westernieland, Schepen;0;0;0;0;2;0;0;0;5;4;9;0;0;GR010
258;B, D, Geh. Broek Wierhuizen, Huizen;16;1;0;1;0;0;0;0;41;45;86;1;0;GR010
259;B, D, Geh. Broek Wierhuizen, Td. aw. ...;0;0;0;0;0;1;0;0;0;0;0;1;2;GR010
260;K, Totaal;416;10;0;28;0;0;0;0;771;884;1655;33;14;GR010
261;K, A, Dorp Eenrum, Gem. Armh.;1;0;0;0;0;0;0;0;6;9;15;0;0;GR010
262;K, A, Dorp Eenrum, Overige huizen;243;7;0;18;0;0;0;0;448;510;958;22;9;GR010
263;K, B, Dorp Pieterburen, Armhuis;1;0;0;0;0;0;0;0;6;6;12;0;0;GR010
264;K, B, Dorp Pieterburen, Overige huizen;98;1;0;6;0;0;0;0;176;216;392;8;4;GR010
265;K, C, Dorp Westernieland, Huizen;49;1;0;4;0;0;0;0;87;97;184;3;1;GR010
266;K, D, Geh. Broek Wierhuizen, Huizen;24;1;0;0;0;0;0;0;48;46;94;0;0;GR010
267;Algemeen totaal;439;27;0;17;5;1;0;0;885;848;1733;22;23;GR011
268;B, Totaal;149;11;0;3;5;1;0;0;428;372;800;9;11;GR011
269;B, A, Dorp Ezinge, Huizen;44;2;0;0;0;0;0;0;138;116;254;1;2;GR011
270;B, B, Dorp Feerwerd, Huizen;61;6;0;2;0;0;0;0;138;134;272;5;2;GR011
271;B, B, Dorp Feerwerd, Schepen;0;0;0;0;3;0;0;0;7;4;11;0;0;GR011
272;B, C, Dorp Garnwerd, Huizen;20;3;0;0;0;0;0;0;75;62;137;0;2;GR011
273;B, C, Dorp Garnwerd, Schepen;0;0;0;0;2;0;0;0;5;5;10;0;0;GR011
274;B, C, Dorp Garnwerd, Tijd. aanw. schip;0;0;0;0;0;1;0;0;0;0;0;2;4;GR011
275;B, D, Buurtsch. Oostum, Huizen;24;0;0;1;0;0;0;0;65;51;116;1;1;GR011
276;K, Totaal;290;16;0;14;0;0;0;0;457;476;933;13;12;GR010
277;K, A, Dorp Ezinge, Huizen;128;4;0;5;0;0;0;0;197;202;399;5;5;GR010
278;K, B, Dorp Feerwerd, Huizen;66;4;0;2;0;0;0;0;111;119;230;4;3;GR010
279;K, C, Dorp Garnwerd, Huizen;96;8;0;7;0;0;0;0;149;155;304;4;4;GR010
280;Algemeen totaal;709;17;0;32;0;0;0;0;1542;1509;3051;38;23;GR011
281;B, Totaal;337;6;0;17;0;0;0;0;805;737;1542;14;9;GR011
282;B, A, Buurt Finsterwolderpolder, Huizen;1;0;0;0;0;0;0;0;2;2;4;0;0;GR011
283;B, A, Buurt Reiderwolderpolder, Huizen;53;1;0;1;0;0;0;0;141;142;283;1;1;GR011
284;B, B, Buurt Oudedijk, Huizen;16;0;0;0;0;0;0;0;39;33;72;0;0;GR011
285;B, B, Buurt Finsterwolderhamrik, Huizen;46;1;0;5;0;0;0;0;110;102;212;1;0;GR011
286;B, B, Buurt Fledder, Huizen;1;0;0;1;0;0;0;0;1;2;3;0;0;GR011
287;B, B, Buurt Modderlanden, Huizen;17;1;0;0;0;0;0;0;39;36;75;0;1;GR011
288;B, B, Buurt Veenhuizen, Huizen;3;0;0;2;0;0;0;0;8;7;15;1;1;GR011
289;B, B, Geh. Ganzedijk, Huizen;74;1;0;5;0;0;0;0;170;158;328;0;1;GR011
290;B, D, Buurt Goldhoorn, Huizen;2;1;0;0;0;0;0;0;5;8;13;1;0;GR011
291;B, E, Geh. Meerland, Huizen;76;0;0;1;0;0;0;0;174;151;325;7;4;GR011
292;B, E, Geh. Ekamp, Huizen;43;1;0;2;0;0;0;0;105;86;191;2;1;GR011
293;B, E, Buurt Hardenberg, Huizen;5;0;0;0;0;0;0;0;11;10;21;1;0;GR011
294;K, Totaal;372;11;0;15;0;0;0;0;737;772;1509;24;14;GR011
295;K, C, Dorp Finsterwolde, Armenhuis;1;0;0;0;0;0;0;0;7;9;16;0;0;GR011
296;K, C, Dorp Finsterwolde, Kaz. Kon. Mar.;1;0;0;0;0;0;0;0;4;4;8;0;0;GR011
297;K, C, Dorp Finsterwolde, Overige huizen;143;5;0;8;0;0;0;0;265;312;577;15;6;GR011
298;K, D, Dorp Finsterwolde, Huizen;227;6;0;7;0;0;0;0;461;447;908;9;8;GR011
299;Algemeen totaal;11346;162;160;788;638;254;3;0;31419;35118;66537;1565;1331;GR014
300;B, Totaal;190;11;1;47;638;254;3;0;2140;2018;4158;642;581;GR014
301;B, U, Huizen;86;5;1;25;0;0;0;0;274;267;541;1;0;GR014
302;B, U, Woonwagen;0;0;0;0;0;0;1;0;3;6;9;0;0;GR014
303;B, V, Huizen;19;0;0;1;0;0;0;0;55;59;114;0;0;GR014
304;B, W, Huizen;7;0;0;4;0;0;0;0;11;12;23;0;0;GR014
305;B, X, Huizen;42;5;0;17;0;0;0;0;84;99;183;1;0;GR014
306;B, Z, Huizen;36;1;0;0;0;0;0;0;100;84;184;0;0;GR014
307;B, Z, Schepen;0;0;0;0;638;0;0;0;1608;1487;3095;10;10;GR014
308;B, Z, Tijd. aanw. schepen;0;0;0;0;0;254;0;0;0;0;0;630;571;GR014
309;B, Z, Woonwagens;0;0;0;0;0;0;2;0;5;4;9;0;0;GR014
310;K, Totaal;11157;151;159;741;0;0;0;0;29254;30089;62343;923;750;GR013
311;K, A, Doopsgezind Weeshuis;1;0;0;0;0;0;0;0;5;4;9;0;1;GR011
312;K, A, Roode- of Burgerweeshuis;1;0;0;0;0;0;0;0;1;7;8;0;0;GR011
313;K, A, R.K. Liefdegesticht;1;0;0;0;0;0;0;0;40;121;161;0;0;GR011
314;K, A, Cornelia-Gasthuis;1;0;0;0;0;0;0;0;0;7;7;0;0;GR011
315;K, A, Overige huizen;217;8;0;53;0;0;0;0;499;799;1298;27;35;GR011
316;K, B, Groene Weeshuis;1;0;0;0;0;0;0;0;69;46;115;0;0;GR012
317;K, B, Groningsche Kook- en huishoudsch.;1;0;0;0;0;0;0;0;0;12;12;0;0;GR012
318;K, B, Overige huizen;126;1;2;24;0;0;0;0;313;457;770;14;16;GR012
319;K, C, R.K. Ziekenverpleging;1;0;0;0;0;0;0;0;0;17;17;6;9;GR012
320;K, C, Toevluchtsoord verwaarl. meisjes;1;0;0;0;0;0;0;0;0;30;30;0;0;GR012
321;K, C, Kinderziekenhuis;1;0;0;0;0;0;0;0;0;9;9;11;10;GR012
322;K, C, Militaire woningen;5;0;0;0;0;0;0;0;10;12;22;0;0;GR012
323;K, C, Overige huizen;152;1;0;48;0;0;0;0;402;487;889;15;17;GR012
324;K, D, Geertruids-Gasthuis;1;0;0;0;0;0;0;0;27;58;85;0;0;GR012
325;K, D, Overige huizen;104;1;0;34;0;0;0;0;357;492;849;13;19;GR012
326;K, E, Huizen;214;9;0;30;0;0;0;0;652;850;1502;41;40;GR012
327;K, F, Luth. Verzorgingsgesticht;1;0;0;0;0;0;0;0;3;6;9;0;0;GR012
328;K, F, H. Geest-Gasthuis;1;0;0;0;0;0;0;0;25;63;88;0;0;GR012
329;K, F, Evang. Luth. Weeshuis;1;0;0;0;0;0;0;0;4;2;6;0;1;GR012
330;K, F, Luth. Gasthuis;1;0;0;0;0;0;0;0;3;12;15;0;0;GR012
331;K, F, Te Huis voor vrouwen;1;0;0;0;0;0;0;0;0;5;5;0;1;GR012
332;K, F, Overige huizen;322;5;0;34;0;0;0;0;845;1105;1950;37;38;GR012
333;K, G, R.K. Gasthuis;1;0;0;0;0;0;0;0;0;6;6;0;0;GR012
334;K, G, R.K. Zusterschool;1;0;0;0;0;0;0;0;0;18;18;0;0;GR012
335;K, G, Israel. Oude Mannen- en Vrouwenh.;1;0;0;0;0;0;0;0;6;7;13;0;0;GR012
336;K, G, Stads- en Academisch-Ziekenhuis;1;0;0;0;0;0;0;0;12;46;58;58;54;GR012
337;K, G, Aduarder-Gasthuis;1;0;0;0;0;0;0;0;0;12;12;0;0;GR012
338;K, G, Overige huizen;298;4;0;34;0;0;0;0;879;949;1828;26;24;GR012
339;K, H, Gasthuis v/h. Armhuis-Convent;1;0;0;0;0;0;0;0;1;23;24;0;0;GR012
340;K, H, Instituut Reddingius;1;0;0;0;0;0;0;0;0;23;23;0;2;GR012
341;K, H, Overige huizen;132;6;7;13;0;0;0;0;438;528;966;14;18;GR012
342;K, I, Mepschen-Gasthuis;1;0;0;0;0;0;0;0;0;15;15;0;0;GR012
343;K, I, Cornelia-Gasthuis;1;0;0;0;0;0;0;0;0;9;9;0;0;GR012
344;K, I, Zeilsgasthuis;1;0;0;0;0;0;0;0;0;4;4;0;0;GR012
345;K, I, Jacob- en Anna-gasthuis;1;0;0;0;0;0;0;0;0;18;18;0;1;GR012
346;K, I, Overige huizen;297;7;3;62;0;0;0;0;781;988;1769;22;28;GR012
347;K, K, Ubbena-Gasthuis;1;0;0;0;0;0;0;0;0;11;11;0;0;GR012
348;K, K, Overige huizen;251;4;0;30;0;0;0;0;665;860;1525;23;33;GR012
349;K, L, Het Midden Gasthuis;1;0;0;0;0;0;0;0;3;4;7;0;0;GR012
350;K, L, Het Gerarda;1;0;0;0;0;0;0;0;0;18;8;0;0;GR012
351;K, L, Het Anna-Varwers Gasth.;2;0;0;0;0;0;0;0;0;12;12;0;0;GR012
352;K, L, Het St. Martinus;3;0;0;0;0;0;0;0;8;19;27;0;1;GR012
353;K, L, Het Gasth. v d. Werkenden Stand;1;0;0;0;0;0;0;0;2;7;9;0;0;GR012
354;K, L, Het Jansons Gasthuis;1;0;0;0;0;0;0;0;16;42;58;0;0;GR012
355;K, L, Het Geneeskund. gest. voor krankz.;1;0;0;0;0;0;0;0;5;11;16;0;0;GR013
356;K, L, Het Huis van Arrest en Bewaring;1;0;0;0;0;0;0;0;3;3;6;18;2;GR013
357;K, L, Overige huizen;681;5;5;22;0;0;0;0;1459;1581;3040;18;28;GR013
358;K, M, Het Midden-Gasthuis;1;0;0;0;0;0;0;0;12;27;39;0;0;GR013
359;K, M, Instituut v. Doofstommen;3;0;0;0;0;0;0;0;120;91;211;0;1;GR013
360;K, M, Overige huizen;223;3;2;7;0;0;0;0;505;572;1077;12;14;GR013
361;K, N, Het Gasth. der Remonstr. gemeente;5;0;0;0;0;0;0;0;1;7;8;0;0;GR013
362;K, N, De Hesselinkstichting;1;0;0;0;0;0;0;0;1;11;12;0;0;GR013
363;K, N, Overige huizen;281;2;0;17;0;0;0;0;740;947;1687;25;23;GR013
364;K, O, Het Gasthuis v d. Werkenden Stand;1;0;0;0;0;0;0;0;4;4;8;0;0;GR013
365;K, O, Het Bethesda Gasthuis;1;0;0;0;0;0;0;0;6;18;24;0;0;GR013
366;K, O, Overige huizen;419;3;8;9;0;0;0;0;918;1099;2017;15;20;GR013
367;K, P, Het Doorgangshuis;2;0;0;0;0;0;0;0;9;70;79;0;0;GR013
368;K, P, Overige huizen;1002;8;6;60;0;0;0;0;2420;2627;5047;36;37;GR013
369;K, Q, Te Huis voor Dakloozen;1;0;0;0;0;0;0;0;24;2;26;0;0;GR013
370;K, Q, Overige huizen;119;0;0;27;0;0;0;0;311;359;670;9;4;GR013
371;K, R, Het Anthonie Gasthuis;1;0;0;0;0;0;0;0;7;24;31;0;0;GR013
372;K, R, Het Vrouw Franssengasth.;1;0;0;0;0;0;0;0;0;4;4;0;0;GR013
373;K, R, Het Scheuningsgasthuis;2;0;0;0;0;0;0;0;0;2;2;0;0;GR013
374;K, R, de Volksgaarkeuken;1;0;0;0;0;0;0;0;10;2;12;6;0;GR013
375;K, R, Overige huizen;598;7;6;69;0;0;0;0;1493;1815;3308;42;39;GR013
376;K, S, Diaconessenhuis;1;0;0;0;0;0;0;0;2;23;25;3;7;GR013
377;K, S, Inr. voor ooglijders;1;0;0;0;0;0;0;0;0;3;3;4;1;GR013
